{
  "artifact": {
    "out_path": "baseline://etl/phase2/reporting/contracts/baselines/now/p01_p02_p03_q02_q03_q04_e03_e04.v1.json",
    "sha256": "sha256:cfbf4af78755b68e29aa28d336c3f50bf4a989ea2d8d6bb10b7e7479c04b7bcf"
  },
  "contract_version": "v1",
  "figures": [
    {
      "artifact": {
        "path": "baseline://now/E-03_threshold_provenance_completeness.json",
        "row_count": 1,
        "sha256": "sha256:b36a75f91b224482b4fc575c0dde194d2d68e2a9774c776b7be1946dc690938b"
      },
      "contract_refs": ["etl/phase3/sql/phase3_rollups_6subtype_checks.sql"],
      "figure_id": "E-03_threshold_provenance_completeness",
      "hard_gate": "pass",
      "metrics": {
        "default_threshold_share": 0.83,
        "invalid_rows_total": 0,
        "invalid_threshold_source_rows": 0,
        "missing_default_threshold_citation_rows": 0
      },
      "payload_version": "v1",
      "schema_version": "1.0.0",
      "status": "pass",
      "validation": {
        "error_count": 0,
        "errors": [],
        "ok": true
      }
    },
    {
      "artifact": {
        "path": "baseline://now/E-04_rank2_quarantine_case_study.json",
        "row_count": 1,
        "sha256": "sha256:f05af69b948fee0a171789f748f75bfca47b7625b5deddf871364713b8dda2ab"
      },
      "contract_refs": [
        "etl/phase2/sql/phase2_post_batch10_checks.sql",
        "etl/phase2/sql/phase2_post_quarantine_checks.sql"
      ],
      "figure_id": "E-04_rank2_quarantine_case_study",
      "hard_gate": "pass",
      "metrics": {
        "cohort_note_count": 1,
        "mode": "frozen_case_study",
        "post_batch10_readiness_rows": 9,
        "rank2_current_target_measurements_expected": 0,
        "source_stage": "post_batch10"
      },
      "payload_version": "v1",
      "schema_version": "1.0.0",
      "status": "pass",
      "validation": {
        "error_count": 0,
        "errors": [],
        "ok": true
      }
    },
    {
      "artifact": {
        "path": "baseline://now/P-01_stage_progression_contract_curve.json",
        "row_count": 6,
        "sha256": "sha256:3ff794df053a369f8ff54f9d94bbb49c7078cf872e8735378c91eeec8f06aefb"
      },
      "contract_refs": [
        "etl/phase2/POD_WAVES_RUNBOOK.md",
        "etl/phase2/decisions/phase2_wave_manifest.csv",
        "etl/phase2/sql/phase2_replay_final_checks.sql"
      ],
      "figure_id": "P-01_stage_progression_contract_curve",
      "hard_gate": "pass",
      "metrics": {
        "baseline_resolved": 0,
        "baseline_unresolved": 42,
        "contract_ref": "etl/phase2/POD_WAVES_RUNBOOK.md",
        "stages": [
          {
            "delta_resolved_rows": 16,
            "delta_unresolved_rows": -16,
            "executed": true,
            "expected_resolved_rows": 16,
            "expected_unresolved_rows": 26,
            "resolved_rows": 16,
            "stage_id": "fructan_wave01",
            "unresolved_rows": 26
          },
          {
            "delta_resolved_rows": 5,
            "delta_unresolved_rows": -5,
            "executed": true,
            "expected_resolved_rows": 21,
            "expected_unresolved_rows": 21,
            "resolved_rows": 21,
            "stage_id": "fructan_wave02",
            "unresolved_rows": 21
          },
          {
            "delta_resolved_rows": 6,
            "delta_unresolved_rows": -6,
            "executed": true,
            "expected_resolved_rows": 27,
            "expected_unresolved_rows": 15,
            "resolved_rows": 27,
            "stage_id": "gos_wave01",
            "unresolved_rows": 15
          },
          {
            "delta_resolved_rows": 6,
            "delta_unresolved_rows": -6,
            "executed": true,
            "expected_resolved_rows": 33,
            "expected_unresolved_rows": 9,
            "resolved_rows": 33,
            "stage_id": "gos_wave02",
            "unresolved_rows": 9
          },
          {
            "delta_resolved_rows": 6,
            "delta_unresolved_rows": -6,
            "executed": true,
            "expected_resolved_rows": 39,
            "expected_unresolved_rows": 3,
            "resolved_rows": 39,
            "stage_id": "polyol_wave01",
            "unresolved_rows": 3
          },
          {
            "delta_resolved_rows": 3,
            "delta_unresolved_rows": -3,
            "executed": true,
            "expected_resolved_rows": 42,
            "expected_unresolved_rows": 0,
            "resolved_rows": 42,
            "stage_id": "polyol_wave02",
            "unresolved_rows": 0
          }
        ]
      },
      "payload_version": "v1",
      "schema_version": "1.0.0",
      "status": "pass",
      "validation": {
        "error_count": 0,
        "errors": [],
        "ok": true
      }
    },
    {
      "artifact": {
        "path": "baseline://now/P-02_candidate_pool_split_by_stage.json",
        "row_count": 6,
        "sha256": "sha256:40e5ce7227d9523aa4de73cbf4bd27440ef9108d3a0bfc9b9ae10f1a1cb99160"
      },
      "contract_refs": [
        "etl/phase2/sql/phase2_fructan_wave01_checks.sql",
        "etl/phase2/sql/phase2_fructan_wave02_checks.sql",
        "etl/phase2/sql/phase2_gos_wave01_checks.sql",
        "etl/phase2/sql/phase2_gos_wave02_checks.sql",
        "etl/phase2/sql/phase2_polyol_wave01_checks.sql",
        "etl/phase2/sql/phase2_polyol_wave02_checks.sql"
      ],
      "figure_id": "P-02_candidate_pool_split_by_stage",
      "hard_gate": "pass",
      "metrics": {
        "stages": [
          {
            "pool_closure_rate": 0.6154,
            "stage_id": "fructan_wave01",
            "unresolved_rows": 26,
            "with_candidates_rows": 16,
            "without_candidates_rows": 10
          },
          {
            "pool_closure_rate": 0.7143,
            "stage_id": "fructan_wave02",
            "unresolved_rows": 21,
            "with_candidates_rows": 15,
            "without_candidates_rows": 6
          },
          {
            "pool_closure_rate": 0.6,
            "stage_id": "gos_wave01",
            "unresolved_rows": 15,
            "with_candidates_rows": 9,
            "without_candidates_rows": 6
          },
          {
            "pool_closure_rate": 0.6667,
            "stage_id": "gos_wave02",
            "unresolved_rows": 9,
            "with_candidates_rows": 6,
            "without_candidates_rows": 3
          },
          {
            "pool_closure_rate": 0.3333,
            "stage_id": "polyol_wave01",
            "unresolved_rows": 3,
            "with_candidates_rows": 1,
            "without_candidates_rows": 2
          },
          {
            "pool_closure_rate": 1.0,
            "stage_id": "polyol_wave02",
            "unresolved_rows": 0,
            "with_candidates_rows": 0,
            "without_candidates_rows": 0
          }
        ],
        "total_with_candidates": 47,
        "total_without_candidates": 27
      },
      "payload_version": "v1",
      "schema_version": "1.0.0",
      "status": "pass",
      "validation": {
        "error_count": 0,
        "errors": [],
        "ok": true
      }
    },
    {
      "artifact": {
        "path": "baseline://now/P-03_gap_completion_matrix.json",
        "row_count": 4,
        "sha256": "sha256:2f85776113d202106161b070e5e71c3d5febe25f883b0a63a9af49daadf50648"
      },
      "contract_refs": [
        "etl/phase2/sql/phase2_post_batch10_checks.sql",
        "etl/phase2/sql/phase2_replay_final_checks.sql",
        "etl/phase2/sql/phase2_scaffold_views.sql"
      ],
      "figure_id": "P-03_gap_completion_matrix",
      "hard_gate": "pass",
      "metrics": {
        "bucket_rows": [
          {
            "bucket": "fructan/fructan",
            "completed_rows": 16,
            "completion_ratio": 0.941,
            "pending_measurement_rows": 1,
            "priority_rows": 17,
            "readiness_gap": 1,
            "resolved_rows": 17,
            "unresolved_rows": 0
          },
          {
            "bucket": "gos/gos",
            "completed_rows": 12,
            "completion_ratio": 1.0,
            "pending_measurement_rows": 0,
            "priority_rows": 12,
            "readiness_gap": 0,
            "resolved_rows": 12,
            "unresolved_rows": 0
          },
          {
            "bucket": "polyol/sorbitol",
            "completed_rows": 7,
            "completion_ratio": 1.0,
            "pending_measurement_rows": 0,
            "priority_rows": 7,
            "readiness_gap": 0,
            "resolved_rows": 7,
            "unresolved_rows": 0
          },
          {
            "bucket": "polyol/mannitol",
            "completed_rows": 6,
            "completion_ratio": 1.0,
            "pending_measurement_rows": 0,
            "priority_rows": 6,
            "readiness_gap": 0,
            "resolved_rows": 6,
            "unresolved_rows": 0
          }
        ],
        "completion_ratio": 0.976,
        "readiness_gap": 1
      },
      "payload_version": "v1",
      "schema_version": "1.0.0",
      "status": "pass",
      "validation": {
        "error_count": 0,
        "errors": [],
        "ok": true
      }
    },
    {
      "artifact": {
        "path": "baseline://now/Q-02_critical_contract_scorecard.json",
        "row_count": 1,
        "sha256": "sha256:8b542c60423e9b15f02a62f4e7b6d0b6a9339ba4d3fe413feab8a4b7da8f2d62"
      },
      "contract_refs": [
        "api/app/sql.py",
        "etl/phase2/sql/phase2_replay_final_checks.sql",
        "etl/phase3/sql/phase3_rollups_6subtype_checks.sql"
      ],
      "figure_id": "Q-02_critical_contract_scorecard",
      "hard_gate": "pass",
      "metrics": {
        "contract_checks": {
          "phase2_ok": true,
          "phase3_ok": true,
          "rank2_api_ok": true
        },
        "phase2_gap_tuples": [
          {
            "bucket": "fructan/fructan",
            "ok": true,
            "tuple": {
              "resolved": 17,
              "total": 17,
              "unresolved": 0